{"$schema":"https://json-schema.org/draft/2020-12/schema","$id":"https://devflow.local/schemas/milestone-validation-evidence-v1.schema.json","title":"DevFlow milestone validation evidence","type":"object","additionalProperties":false,"required":["schemaVersion","kind","contractId","checks","pluginEval","secretScan","unexpectedCandidateFiles","unresolvedBlockers"],"properties":{"schemaVersion":{"const":"1.0"},"kind":{"const":"devflow-milestone-validation-evidence"},"contractId":{"type":"string","minLength":1},"checks":{"type":"array","minItems":8,"maxItems":8,"uniqueItems":true,"items":{"$ref":"#/$defs/check"}},"pluginEval":{"$ref":"#/$defs/pluginEval"},"secretScan":{"type":"object","additionalProperties":false,"required":["status","findings"],"properties":{"status":{"const":"pass"},"findings":{"type":"array","maxItems":0}}},"unexpectedCandidateFiles":{"type":"array","maxItems":0},"unresolvedBlockers":{"type":"array","maxItems":0}},"$defs":{"counts":{"type":"object","additionalProperties":false,"required":["passed","failed","skipped"],"properties":{"passed":{"type":"integer","minimum":1},"failed":{"const":0},"skipped":{"type":"integer","minimum":0}}},"check":{"type":"object","additionalProperties":false,"required":["id","command","exitCode","status","counts"],"properties":{"id":{"enum":["completion-contract","focused-tests","broad-tests","devflow-validators","source-release-parity","secret-scan","unexpected-candidate-scan","blocker-scan"]},"command":{"type":"string","minLength":1},"exitCode":{"const":0},"status":{"const":"pass"},"counts":{"$ref":"#/$defs/counts"}}},"finding":{"type":"object","additionalProperties":false,"required":["id","severity","decision","rationale"],"properties":{"id":{"type":"string","minLength":1},"severity":{"enum":["warning","info"]},"decision":{"type":"string","minLength":1},"rationale":{"type":"string","minLength":1}}},"pluginEval":{"type":"object","additionalProperties":false,"required":["target","command","exitCode","status","score","grade","failFindings","warnFindings","findings"],"properties":{"target":{"const":"plugins/dev-flow"},"command":{"const":"plugin-eval analyze plugins/dev-flow --format markdown"},"exitCode":{"const":0},"status":{"const":"pass"},"score":{"type":"integer","minimum":0,"maximum":100},"grade":{"type":"string","pattern":"^[A-F][+-]?$"},"failFindings":{"const":0},"warnFindings":{"type":"integer","minimum":0},"findings":{"type":"array","items":{"$ref":"#/$defs/finding"}}}}}}
